{
  "$schema": "https://json-schema.org/draft/2020-12/schema",
  "title": "CheckYourself Coverage Matrix",
  "type": "object",
  "required": ["tool", "schema", "generated_at", "surfaces"],
  "properties": {
    "tool": { "type": "string" },
    "schema": { "type": "string", "enum": ["checkyourself-coverage/1"] },
    "generated_at": { "type": "string" },
    "project": { "type": "string" },
    "surfaces": {
      "type": "array",
      "items": {
        "type": "object",
        "required": [
          "id",
          "surface",
          "category",
          "status",
          "evidence_reviewed",
          "missing_evidence",
          "not_applicable_reason"
        ],
        "properties": {
          "id": { "type": "string" },
          "surface": { "type": "string" },
          "category": { "type": "string" },
          "status": {
            "type": ["string", "null"],
            "enum": ["Pass", "Finding", "Unknown", "NotApplicable", null]
          },
          "evidence_reviewed": { "type": "array", "items": { "type": "string" } },
          "evidence_receipts": {
            "type": "array",
            "description": "Verifier-captured receipts. Reviewer assertions in evidence_reviewed do not earn Pass credit without these.",
            "items": {
              "oneOf": [
                {
                  "type": "object",
                  "required": ["reference", "sha256", "subject_digest", "surface_id", "source_revision", "command", "claim", "origin", "source_state", "result", "issuer", "issued_at", "receipt_sha256"],
                  "properties": {
                    "reference": { "type": "string" },
                    "sha256": { "type": "string", "pattern": "^[0-9a-fA-F]{64}$" },
                    "subject_digest": { "type": "string", "pattern": "^[0-9a-fA-F]{64}$" },
                    "surface_id": { "type": "string", "pattern": "^S(0[1-9]|1[0-9]|20)$" },
                    "source_revision": { "type": "string", "minLength": 1 },
                    "command": { "type": "string", "minLength": 1 },
                    "claim": { "type": "string", "minLength": 1 },
                    "origin": { "type": "string", "minLength": 1 },
                    "source_state": { "type": "string", "minLength": 1 },
                    "result": { "type": "string", "minLength": 1 },
                    "issuer": { "type": "string", "const": "checkyourself-verifier/1" },
                    "issued_at": { "type": "string", "minLength": 1 },
                    "receipt_sha256": { "type": "string", "pattern": "^[0-9a-fA-F]{64}$" }
                  }
                },
                {
                  "type": "object",
                  "required": ["receipt_type", "surface_id", "command", "cwd", "exit_code", "captured_output", "captured_output_digest", "semantic_output_digest", "source_revision", "timestamp", "timed_out", "status", "execution_error", "challenge_config_digest", "run_id", "receipt_sha256", "local_integrity_hmac"],
                  "properties": {
                    "receipt_type": { "type": "string", "const": "EXECUTED" },
                    "surface_id": { "type": "string", "pattern": "^S(0[1-9]|1[0-9]|20)$" },
                    "command": { "type": "array", "items": { "type": "string" } },
                    "cwd": { "type": "string" },
                    "exit_code": { "type": ["integer", "null"] },
                    "captured_output": { "type": "string", "minLength": 1 },
                    "captured_output_digest": { "type": "string", "pattern": "^[0-9a-fA-F]{64}$" },
                    "semantic_output_digest": { "type": "string", "pattern": "^[0-9a-fA-F]{64}$" },
                    "source_revision": { "type": "string", "minLength": 1 },
                    "timestamp": { "type": "string", "minLength": 1 },
                    "timed_out": { "type": "boolean" },
                    "status": { "type": "string", "enum": ["PASS", "FAIL"] },
                    "execution_error": { "type": "string" },
                    "challenge_config_digest": { "type": "string", "pattern": "^[0-9a-fA-F]{64}$" },
                    "run_id": { "type": "string", "pattern": "^[0-9a-fA-F]{32}$" },
                    "receipt_sha256": { "type": "string", "pattern": "^[0-9a-fA-F]{64}$" },
                    "local_integrity_hmac": { "type": "string", "pattern": "^[0-9a-fA-F]{64}$" },
                    "receipt_path": { "type": "string", "minLength": 1 }
                  }
                }
              ]
            }
          },
          "missing_evidence": { "type": "array", "items": { "type": "string" } },
          "not_applicable_reason": { "type": "string" },
          "delegation_receipts": {
            "type": "array",
            "description": "Verifier-captured artifacts proving delegated responsibility for NotApplicable.",
            "items": {
              "type": "object",
              "required": ["reference", "sha256", "subject_digest", "surface_id", "source_revision", "command", "claim", "origin", "source_state", "result", "issuer", "issued_at", "receipt_sha256"],
              "properties": {
                "reference": { "type": "string" },
                "sha256": { "type": "string", "pattern": "^[0-9a-fA-F]{64}$" },
                "subject_digest": { "type": "string", "pattern": "^[0-9a-fA-F]{64}$" },
                "surface_id": { "type": "string", "pattern": "^S(0[1-9]|1[0-9]|20)$" },
                "source_revision": { "type": "string", "minLength": 1 },
                "command": { "type": "string", "minLength": 1 },
                "claim": { "type": "string", "minLength": 1 },
                "origin": { "type": "string", "minLength": 1 },
                "source_state": { "type": "string", "minLength": 1 },
                "result": { "type": "string", "minLength": 1 },
                "issuer": { "type": "string", "const": "checkyourself-verifier/1" },
                "issued_at": { "type": "string", "minLength": 1 },
                "receipt_sha256": { "type": "string", "pattern": "^[0-9a-fA-F]{64}$" }
              }
            }
          },
          "claim_bound_evidence": { "type": "array", "items": { "type": "string" } },
          "claim": { "type": "string" },
          "finding_ids": { "type": "array", "items": { "type": "string" } }
        }
      }
    }
  }
}
