{
  "tool": "checkyourself-cli",
  "schema": "checkyourself-coverage/1",
  "generated_at": "2026-05-29T03:04:00-07:00",
  "project": "CheckYourself public GitHub repo",
  "surfaces": [
    {
      "id": "S01",
      "surface": "Product purpose, users, and harm model",
      "category": "context",
      "status": "Pass",
      "evidence_reviewed": [
        "README.md, START_HERE.md, and PASTE_THIS_INTO_YOUR_AI.md define audience, outputs, and approval workflow."
      ],
      "missing_evidence": [],
      "not_applicable_reason": ""
    },
    {
      "id": "S02",
      "surface": "Stack, architecture, and dependency map",
      "category": "context",
      "status": "Pass",
      "evidence_reviewed": [
        "tools/checkyourself.py describe/scan, checkyourself.manifest.json, and docs/cli.md define the file-first architecture."
      ],
      "missing_evidence": [],
      "not_applicable_reason": ""
    },
    {
      "id": "S03",
      "surface": "Frontend UX, accessibility, and client safety",
      "category": "C9",
      "status": "Pass",
      "evidence_reviewed": [
        "10_DASHBOARD/dashboard-template.html, dashboard-smoke-check.md, and the rendered dogfood dashboard/screenshot exist."
      ],
      "missing_evidence": [],
      "not_applicable_reason": ""
    },
    {
      "id": "S04",
      "surface": "API/backend behavior, validation, uploads, and webhooks",
      "category": "C4",
      "status": "NotApplicable",
      "evidence_reviewed": [],
      "missing_evidence": [],
      "not_applicable_reason": "Public product has no hosted backend, API runtime, upload endpoint, or webhook receiver."
    },
    {
      "id": "S05",
      "surface": "Auth, permissions, sessions, roles, and admin paths",
      "category": "C2",
      "status": "NotApplicable",
      "evidence_reviewed": [],
      "missing_evidence": [],
      "not_applicable_reason": "Public product has no auth, account, role, session, or admin runtime."
    },
    {
      "id": "S06",
      "surface": "Data storage, migrations, backups, and retention",
      "category": "C1",
      "status": "NotApplicable",
      "evidence_reviewed": [],
      "missing_evidence": [],
      "not_applicable_reason": "Public product has no database, migrations, or persisted user records."
    },
    {
      "id": "S07",
      "surface": "User, tenant, and role isolation",
      "category": "C1",
      "status": "NotApplicable",
      "evidence_reviewed": [],
      "missing_evidence": [],
      "not_applicable_reason": "No multitenant runtime or user data boundary exists in the public product."
    },
    {
      "id": "S08",
      "surface": "Secrets, environment, runtime configuration",
      "category": "C3",
      "status": "Pass",
      "evidence_reviewed": [
        "gitleaks dir and gitleaks git passed; redaction enforced in tools/checkyourself.py:redact_sensitive_text and asserted by tests/test_checkyourself_cli.py:test_secret_values_are_redacted_from_json_output.",
        "Reviewed scanner false positives suppressed with path-scoped reasons in .checkyourself.yml; private Creator Kit excluded via .gitignore."
      ],
      "missing_evidence": [],
      "not_applicable_reason": ""
    },
    {
      "id": "S09",
      "surface": "Security and threat model",
      "category": "C4",
      "status": "Pass",
      "evidence_reviewed": [
        "SECURITY.md defines vulnerability handling; scan tests prove secret values and package script credentials are redacted."
      ],
      "missing_evidence": [],
      "not_applicable_reason": ""
    },
    {
      "id": "S10",
      "surface": "Privacy, consent, compliance, and data governance",
      "category": "C1",
      "status": "Pass",
      "evidence_reviewed": [
        "README.md, SECURITY.md, SUPPORT.md, and AGENTS.md warn against sharing secrets/private data; product is local-first and has no telemetry."
      ],
      "missing_evidence": [],
      "not_applicable_reason": ""
    },
    {
      "id": "S11",
      "surface": "Tests, quality gates, and regression coverage",
      "category": "C5",
      "status": "Pass",
      "evidence_reviewed": [
        "60 unit tests pass (tests/test_checkyourself_cli.py, tests/test_validate_public.py) covering scan, scoring caps, suppressions, MCP error paths, diff, and symlink/truncation guards.",
        "CI runs ruff, pytest, validate_public.py, schema validation, and gitleaks via .github/workflows/validate.yml."
      ],
      "missing_evidence": [],
      "not_applicable_reason": ""
    },
    {
      "id": "S12",
      "surface": "CI/CD and supply chain",
      "category": "C6",
      "status": "Pass",
      "evidence_reviewed": [
        "GitHub Actions 'Validate CheckYourself' passes on v1.7.0 (.github/workflows/validate.yml): public-shape validation, CLI/MCP/diff contract smoke tests, 60 unit tests, and gitleaks.",
        "Supply chain: .github/dependabot.yml covers github-actions and docker; composite action passes inputs via env vars; CY-SUPPLY-* detectors check action pinning, lockfile presence, and npm ci."
      ],
      "missing_evidence": [],
      "not_applicable_reason": ""
    },
    {
      "id": "S13",
      "surface": "Hosting, deployment, release, and rollback",
      "category": "C6",
      "status": "Pass",
      "evidence_reviewed": [
        "Public repository is live at https://github.com/KyaniteLabs/checkyourself; git history is rollback for static repo changes."
      ],
      "missing_evidence": [],
      "not_applicable_reason": ""
    },
    {
      "id": "S14",
      "surface": "Cloud infrastructure and IaC",
      "category": "C6",
      "status": "NotApplicable",
      "evidence_reviewed": [],
      "missing_evidence": [],
      "not_applicable_reason": "No cloud runtime or infrastructure-as-code is shipped in the public product."
    },
    {
      "id": "S15",
      "surface": "Performance, caching, and rate limits",
      "category": "C8",
      "status": "Pass",
      "evidence_reviewed": [
        "AGENTS.md and docs/token-efficiency-and-context-control.md require progressive context loading and dashboard opt-in."
      ],
      "missing_evidence": [],
      "not_applicable_reason": ""
    },
    {
      "id": "S16",
      "surface": "Scaling, load, and resilience",
      "category": "C8",
      "status": "NotApplicable",
      "evidence_reviewed": [],
      "missing_evidence": [],
      "not_applicable_reason": "No service workload exists; scale concern is context-size control, covered by token-efficiency rules."
    },
    {
      "id": "S17",
      "surface": "Observability, logs, errors, and incident response",
      "category": "C7",
      "status": "Pass",
      "evidence_reviewed": [
        "SUPPORT.md, SECURITY.md, GitHub issue template, and GitHub Actions logs define maintainer feedback and incident triage surfaces."
      ],
      "missing_evidence": [],
      "not_applicable_reason": ""
    },
    {
      "id": "S18",
      "surface": "Availability, recovery, and continuity",
      "category": "C1",
      "status": "NotApplicable",
      "evidence_reviewed": [],
      "missing_evidence": [],
      "not_applicable_reason": "Static open-source repo; availability and recovery are GitHub repo history, cloneability, and releases once tagged."
    },
    {
      "id": "S19",
      "surface": "AI/RAG/agent governance",
      "category": "C10",
      "status": "Pass",
      "evidence_reviewed": [
        "AGENTS.md, rules.md, coverage matrix, scoring method, schemas, and samples/dogfood-fixture-broken-app.md govern agent behavior."
      ],
      "missing_evidence": [],
      "not_applicable_reason": ""
    },
    {
      "id": "S20",
      "surface": "Learning needs and remediation history",
      "category": "learning",
      "status": "Pass",
      "evidence_reviewed": [
        "04_LEARNING_PLAN templates and output, CHANGELOG.md, and dogfood reports tie findings to learning and remediation."
      ],
      "missing_evidence": [],
      "not_applicable_reason": ""
    }
  ]
}
